{
  "paper": {
    "doi": "10.1038/s41431-026-02054-5",
    "title": "Systematic benchmarking demonstrates large language models have not reached the diagnostic accuracy of traditional rare-disease decision support tools",
    "code_sha": "bd7146d15798b4dd968fd64bc9a42e6971aa8fae"
  },
  "verdict": "not_reproduced",
  "claims": [
    {
      "id": "RS1",
      "figure": "Figure 3 (medRxiv v3, PMC11302616)",
      "panel": "Top-1, o1 preview \u2014 offline floor (OAK exact match only; CurateGPT step not run)",
      "metric": "RS1_o1_top1_frac_floor",
      "claimed": 0.236,
      "obtained": 0.20161135622482257,
      "tolerance": 0.0005,
      "tolerance_type": "absolute",
      "extraction": "manual",
      "verdict": "not_reproduced",
      "cause_category": "undiagnosed",
      "evidence_path": "work/reese-2026-rescore/results.json"
    },
    {
      "id": "RS2",
      "figure": "Figure 3 (medRxiv v3, PMC11302616)",
      "panel": "Top-3, o1 preview \u2014 offline floor (OAK exact match only; CurateGPT step not run)",
      "metric": "RS2_o1_top3_frac_floor",
      "claimed": 0.312,
      "obtained": 0.2649146364857088,
      "tolerance": 0.0005,
      "tolerance_type": "absolute",
      "extraction": "manual",
      "verdict": "not_reproduced",
      "cause_category": "undiagnosed",
      "evidence_path": "work/reese-2026-rescore/results.json"
    },
    {
      "id": "RS3",
      "figure": "Figure 3 (medRxiv v3, PMC11302616)",
      "panel": "Top-10, o1 preview \u2014 offline floor (OAK exact match only; CurateGPT step not run)",
      "metric": "RS3_o1_top10_frac_floor",
      "claimed": 0.368,
      "obtained": 0.2973335891041627,
      "tolerance": 0.0005,
      "tolerance_type": "absolute",
      "extraction": "manual",
      "verdict": "not_reproduced",
      "cause_category": "undiagnosed",
      "evidence_path": "work/reese-2026-rescore/results.json"
    }
  ],
  "environment_delta": [],
  "data_provenance": [
    {
      "id": "responses_zip",
      "uri": "https://zenodo.org/records/15324355/files/all_models_responses.zip?download=1",
      "dest": "data/reese-2026/all_models_responses.zip",
      "sha256_expected": "3add6cc5764d1b34f4e836ccd9de01187a3b81d87e4d5d5a6a456fb65e08d3ad",
      "sha256_actual": "3add6cc5764d1b34f4e836ccd9de01187a3b81d87e4d5d5a6a456fb65e08d3ad",
      "bytes": 9406802,
      "fetched_at": "2026-09-28T07:00:24.409+00:00",
      "verified": true
    },
    {
      "id": "gold_tsv",
      "uri": "https://zenodo.org/records/15324355/files/correct_results.tsv?download=1",
      "dest": "data/reese-2026/correct_results.tsv",
      "sha256_expected": "e7980547e48b89e61cf0a4b35fb8f5c8660f0dca33232b255fddf8e53482556f",
      "sha256_actual": "e7980547e48b89e61cf0a4b35fb8f5c8660f0dca33232b255fddf8e53482556f",
      "bytes": 474639,
      "fetched_at": "2026-09-28T07:00:25.552+00:00",
      "verified": true
    },
    {
      "id": "mondo_semsql",
      "uri": "file://data/manual/mondo-semsql-2026-09-27/mondo.db.gz",
      "dest": "data/reese-2026/mondo.db.gz",
      "sha256_expected": "499f7078e4b60434e812500db709c8f03d52722c0d5543397947101b04bbefb0",
      "sha256_actual": "499f7078e4b60434e812500db709c8f03d52722c0d5543397947101b04bbefb0",
      "bytes": 242815274,
      "fetched_at": "2026-09-28T07:00:25.837+00:00",
      "verified": true
    },
    {
      "id": "opus_mondo_map",
      "uri": "file://targets/reese-2026-rescore/grounding/opus-mondo-map.tsv",
      "dest": "data/reese-2026/opus-mondo-map.tsv",
      "sha256_expected": "c71db9ada79ab2cf34d1e0bbf58799ecf5e2a8ed7e907ea8e6d2dc53d3320065",
      "sha256_actual": "c71db9ada79ab2cf34d1e0bbf58799ecf5e2a8ed7e907ea8e6d2dc53d3320065",
      "bytes": 406599,
      "fetched_at": "2026-09-28T07:00:25.839+00:00",
      "verified": true
    }
  ],
  "deviations": [
    {
      "what": "RS1-RS3: answer lines are grounded to Mondo by OAK exact matching only; malco's CurateGPT fallback is not run (use_ontogpt_grounding=False)",
      "why": "The fallback queries an OpenAI embedding index at run time; the scored run makes no API call (--network none). Derived from the code: this can only lower the counts.",
      "approved_by": "Michael Wolfe, repro-lab maintainer",
      "date": "2026-09-27"
    },
    {
      "what": "RS4-RS6: lines OAK cannot ground are mapped with a one-time Claude Opus 5.5 table (grounding/opus-mondo-map.tsv, built with Claude Code headless under OAuth) instead of CurateGPT/OpenAI embeddings",
      "why": "Reproduces the role of the paper's fallback step without a run-time API call; the table was built, validated (agreement with OAK on OAK-resolved names >= 0.90, fixed before the call) and committed before this run. It can move the counts in either direction.",
      "approved_by": "Michael Wolfe, repro-lab maintainer",
      "date": "2026-09-27"
    },
    {
      "what": "Opus mapping table (RS4-RS6, EX4): the echo check in grounding/build_opus_map.py compares echoed and input names after Unicode NFC normalisation, instead of byte-exact, from chunk 80 attempt 4 on",
      "why": "Chunk 80 failed 3/3 only because the input Kohlschuetter-Toenz entry used decomposed diacritics (u/o + U+0308) that Opus echoed precomposed. Exact match implies NFC match, so the 94 accepted chunks are unaffected; only chunk 80 reruns; table names and lookups keep the input string byte-for-byte. Committed before chunk 80 reruns.",
      "approved_by": "Michael Wolfe, repro-lab maintainer",
      "date": "2026-09-27"
    },
    {
      "what": "Opus mapping table, attempt 1 (committed at 851a94d): failed the pre-registered gate, agreement with OAK 0.2628 against 0.90; the prompt told the model to abstain when unsure, and it returned no match for 1,323 of 1,876 OAK-resolvable names. RS4-RS6 and EX4 were removed.",
      "why": "Recorded so the substituted-grounding claims show their full history.",
      "approved_by": "Michael Wolfe, repro-lab maintainer",
      "date": "2026-09-27"
    },
    {
      "what": "Opus mapping table, attempt 2 (the last): revised prompt, committed before any call, asks for the single best Mondo term plus a confidence (high/medium/low), and no match only when nothing plausible exists. The gate and its definition are unchanged; confidence is recorded but used neither by the gate nor by the lookup. RS4-RS6 and EX4 are restored only if this attempt passes. Result (grounding/attempt-2/opus-mondo-map.meta.json): agreement 0.3545 against 0.90, gate failed, so RS4-RS6 and EX4 stay removed; Opus now named a term for all but 7 of the 1,876 OAK-resolvable names, but 1,154 of them paired a correct label with a wrong or obsolete Mondo number and fail the validity rule.",
      "why": "Attempt 1 failed because of the abstention instruction, not the mapping procedure; one further attempt was authorised by the maintainer, with no third.",
      "approved_by": "Michael Wolfe, repro-lab maintainer",
      "date": "2026-09-27"
    }
  ],
  "cost": {
    "wall_minutes": 78.517,
    "agent_tokens": 0,
    "usd_estimate": 0.0
  },
  "generated_at": "2026-09-28T08:18:57.404+00:00"
}