{
  "paper": {
    "doi": "10.1038/s41431-026-02054-5",
    "title": "Systematic benchmarking demonstrates large language models have not reached the diagnostic accuracy of traditional rare-disease decision support tools",
    "code_sha": "7a4dc1e06bf489f7815a873ef6c34a83c3b2e99b"
  },
  "verdict": "not_reproduced",
  "claims": [
    {
      "id": "EX1",
      "figure": "Figure 3 (medRxiv v3, PMC11302616)",
      "panel": "Top-1, Exomiser",
      "metric": "EX1_exomiser_top1_frac",
      "claimed": 0.355,
      "obtained": 0.35449836946096297,
      "tolerance": 0.0005,
      "tolerance_type": "absolute",
      "extraction": "manual",
      "verdict": "not_reproduced",
      "cause_category": "undiagnosed",
      "evidence_path": "work/reese-2026-exomiser/results.json"
    },
    {
      "id": "EX2",
      "figure": "Figure 3 (medRxiv v3, PMC11302616)",
      "panel": "Top-3, Exomiser",
      "metric": "EX2_exomiser_top3_frac",
      "claimed": 0.463,
      "obtained": 0.46019566468444273,
      "tolerance": 0.0005,
      "tolerance_type": "absolute",
      "extraction": "manual",
      "verdict": "not_reproduced",
      "cause_category": "undiagnosed",
      "evidence_path": "work/reese-2026-exomiser/results.json"
    },
    {
      "id": "EX3",
      "figure": "Figure 3 (medRxiv v3, PMC11302616)",
      "panel": "Top-10, Exomiser",
      "metric": "EX3_exomiser_top10_frac",
      "claimed": 0.585,
      "obtained": 0.5697295223479762,
      "tolerance": 0.0005,
      "tolerance_type": "absolute",
      "extraction": "manual",
      "verdict": "not_reproduced",
      "cause_category": "undiagnosed",
      "evidence_path": "work/reese-2026-exomiser/results.json"
    }
  ],
  "environment_delta": [],
  "data_provenance": [
    {
      "id": "exomiser_cli_14_0_1",
      "uri": "https://github.com/exomiser/Exomiser/releases/download/14.0.1/exomiser-cli-14.0.1-distribution.zip",
      "dest": "data/reese-2026/exomiser-cli-14.0.1-distribution.zip",
      "sha256_expected": "fbf2cf34dad8fa0e4c994384cba98dc4500d33a51ccfee6cbe4496846cac6acf",
      "sha256_actual": "fbf2cf34dad8fa0e4c994384cba98dc4500d33a51ccfee6cbe4496846cac6acf",
      "bytes": 75878122,
      "fetched_at": "2026-09-28T21:20:59.957+00:00",
      "verified": true
    },
    {
      "id": "exomiser_2406_phenotype",
      "uri": "https://data.monarchinitiative.org/exomiser/data/2406_phenotype.zip",
      "dest": "data/reese-2026/2406_phenotype.zip",
      "sha256_expected": "ce471ab12a608732b36ee106b042e5cbb16452dcd334d745b65f1b0eed76d47b",
      "sha256_actual": "ce471ab12a608732b36ee106b042e5cbb16452dcd334d745b65f1b0eed76d47b",
      "bytes": 6236618638,
      "fetched_at": "2026-09-28T21:24:50.317+00:00",
      "verified": true
    },
    {
      "id": "exomiser_2406_hg19",
      "uri": "https://data.monarchinitiative.org/exomiser/data/2406_hg19.zip",
      "dest": "data/reese-2026/2406_hg19.zip",
      "sha256_expected": "aec3963feaff9fdf6f9d4ec6e7b006531193d6fc1305fbe5b9fbe5fba92d28cd",
      "sha256_actual": "aec3963feaff9fdf6f9d4ec6e7b006531193d6fc1305fbe5b9fbe5fba92d28cd",
      "bytes": 19329398823,
      "fetched_at": "2026-09-28T21:36:40.460+00:00",
      "verified": true
    },
    {
      "id": "phenopackets_tgz",
      "uri": "https://zenodo.org/records/15324355/files/phenopackets.tar.gz?download=1",
      "dest": "data/reese-2026/phenopackets.tar.gz",
      "sha256_expected": "7c84ceaa4407f10a0f19e9fdb0701b592414ff23b4be5151f3e666b41c3264f6",
      "sha256_actual": "7c84ceaa4407f10a0f19e9fdb0701b592414ff23b4be5151f3e666b41c3264f6",
      "bytes": 3412803,
      "fetched_at": "2026-09-28T21:36:43.780+00:00",
      "verified": true
    },
    {
      "id": "gold_tsv",
      "uri": "https://zenodo.org/records/15324355/files/correct_results.tsv?download=1",
      "dest": "data/reese-2026/correct_results.tsv",
      "sha256_expected": "e7980547e48b89e61cf0a4b35fb8f5c8660f0dca33232b255fddf8e53482556f",
      "sha256_actual": "e7980547e48b89e61cf0a4b35fb8f5c8660f0dca33232b255fddf8e53482556f",
      "bytes": 474639,
      "fetched_at": "2026-09-28T21:36:44.961+00:00",
      "verified": true
    },
    {
      "id": "responses_zip",
      "uri": "https://zenodo.org/records/15324355/files/all_models_responses.zip?download=1",
      "dest": "data/reese-2026/all_models_responses.zip",
      "sha256_expected": "3add6cc5764d1b34f4e836ccd9de01187a3b81d87e4d5d5a6a456fb65e08d3ad",
      "sha256_actual": "3add6cc5764d1b34f4e836ccd9de01187a3b81d87e4d5d5a6a456fb65e08d3ad",
      "bytes": 9406802,
      "fetched_at": "2026-09-28T21:36:49.279+00:00",
      "verified": true
    },
    {
      "id": "mondo_semsql",
      "uri": "file://data/manual/mondo-semsql-2026-09-27/mondo.db.gz",
      "dest": "data/reese-2026/mondo.db.gz",
      "sha256_expected": "499f7078e4b60434e812500db709c8f03d52722c0d5543397947101b04bbefb0",
      "sha256_actual": "499f7078e4b60434e812500db709c8f03d52722c0d5543397947101b04bbefb0",
      "bytes": 242815274,
      "fetched_at": "2026-09-28T21:36:49.581+00:00",
      "verified": true
    },
    {
      "id": "opus_mondo_map",
      "uri": "file://targets/reese-2026-rescore/grounding/opus-mondo-map.tsv",
      "dest": "data/reese-2026/opus-mondo-map.tsv",
      "sha256_expected": "c71db9ada79ab2cf34d1e0bbf58799ecf5e2a8ed7e907ea8e6d2dc53d3320065",
      "sha256_actual": "c71db9ada79ab2cf34d1e0bbf58799ecf5e2a8ed7e907ea8e6d2dc53d3320065",
      "bytes": 406599,
      "fetched_at": "2026-09-28T21:36:49.585+00:00",
      "verified": true
    }
  ],
  "deviations": [
    {
      "what": "EX4: o1-preview answers are grounded by OAK exact matching, then the one-time Claude Opus 5.5 table, instead of CurateGPT/OpenAI embeddings",
      "why": "Same as reese-2026-rescore RS4-RS6: no run-time API call; the table is committed and hash-verified.",
      "approved_by": "Michael Wolfe, repro-lab maintainer",
      "date": "2026-09-27"
    },
    {
      "what": "Opus mapping table (RS4-RS6, EX4): the echo check in grounding/build_opus_map.py compares echoed and input names after Unicode NFC normalisation, instead of byte-exact, from chunk 80 attempt 4 on",
      "why": "Chunk 80 failed 3/3 only because the input Kohlschuetter-Toenz entry used decomposed diacritics (u/o + U+0308) that Opus echoed precomposed. Exact match implies NFC match, so the 94 accepted chunks are unaffected; only chunk 80 reruns; table names and lookups keep the input string byte-for-byte. Committed before chunk 80 reruns.",
      "approved_by": "Michael Wolfe, repro-lab maintainer",
      "date": "2026-09-27"
    },
    {
      "what": "Opus mapping table, attempt 1 (committed at 851a94d): failed the pre-registered gate, agreement with OAK 0.2628 against 0.90; the prompt told the model to abstain when unsure, and it returned no match for 1,323 of 1,876 OAK-resolvable names. RS4-RS6 and EX4 were removed.",
      "why": "Recorded so the substituted-grounding claims show their full history.",
      "approved_by": "Michael Wolfe, repro-lab maintainer",
      "date": "2026-09-27"
    },
    {
      "what": "Opus mapping table, attempt 2 (the last): revised prompt, committed before any call, asks for the single best Mondo term plus a confidence (high/medium/low), and no match only when nothing plausible exists. The gate and its definition are unchanged; confidence is recorded but used neither by the gate nor by the lookup. RS4-RS6 and EX4 are restored only if this attempt passes. Result (grounding/attempt-2/opus-mondo-map.meta.json): agreement 0.3545 against 0.90, gate failed, so RS4-RS6 and EX4 stay removed; Opus now named a term for all but 7 of the 1,876 OAK-resolvable names, but 1,154 of them paired a correct label with a wrong or obsolete Mondo number and fail the validity rule.",
      "why": "Attempt 1 failed because of the abstention instruction, not the mapping procedure; one further attempt was authorised by the maintainer, with no third.",
      "approved_by": "Michael Wolfe, repro-lab maintainer",
      "date": "2026-09-27"
    }
  ],
  "cost": {
    "wall_minutes": 288.983,
    "agent_tokens": 0,
    "usd_estimate": 0.0
  },
  "generated_at": "2026-09-29T02:25:50.239+00:00"
}